{
  "schema_version": 1,
  "id": "sigstore-bundle-payload-mismatch-004",
  "class": "sigstore_bundle_payload_mismatch",
  "expected_verdict": "DENY",
  "expected_reason": "sigstore_bundle_payload_mismatch",
  "threat_id": "tool_server_escape",
  "pending": false,
  "artifact": {
    "case_kind": "guard_module_bundle",
    "bundle": {
      "subject_digest": "sha256:approved-guard-module",
      "certificate_identity": "release@chio.dev",
      "certificate_oidc_issuer": "https://token.actions.githubusercontent.com"
    },
    "payload": {
      "module_digest": "sha256:malicious-guard-module",
      "module_name": "redact-secrets.wasm"
    }
  }
}
